{"schema_version":1,"event":"session.ended","seq":2,"ts":"2026-09-13T01:40:00Z","harness":"claude","agent_id":"marvel-b8","workspace":"aae-orc","data":{"reason":"exit","exit_code":0,"usage":{"in":10,"out":20,"cost":0.01},"metering":{"duration_ms":1234,"num_turns":3,"model_usage":{"claude-opus-4-8":{"in":10,"out":20,"context_window":200000}},"permission_denials":[{"tool":"Bash","call_id":"c1"}]}}}
