{"schema_version":1,"event":"turn.completed","seq":4,"ts":"2026-09-13T01:40:00Z","harness":"claude","agent_id":"marvel-b8","workspace":"aae-orc","data":{"usage_delta":{"in":5,"out":40},"request":{"request_id":"r1","model":"claude-opus-4-8","layout":"additive","in":10,"out":40,"cache_read_in":29903,"cache_creation_in":0,"context_window":200000}}}
